,job,location,date,company
0,"Principal Software Engineer, Trilogy (Remote) - $200,000/year USD","Toronto, ON À distance",Il y a 1 jour,Crossover for Work
1,"Senior Support Engineer, Trilogy (Remote) - $100,000/year USD","Ontario, Canada À distance",Il y a 1 jour,Crossover for Work
2,"Software Engineer, Upland (Remote) - $30,000/year USD","Toronto, ON À distance",Il y a 1 jour,Crossover for Work
3,"Sales Development Representative, Aurea Software (Remote) - $60,000/year USD","Ottawa, ON À distance",Il y a 1 jour,Crossover for Work
4,"Senior Software Engineer, TelcoDR (Remote) - $160,000/year USD","Toronto, ON À distance",Il y a 1 jour,Crossover for Work
5,"Product Designer, Upland (Remote) - $100,000/year USD","Toronto, ON À distance",Il y a 1 jour,Crossover for Work
6,"Software Developer, Trilogy (Remote) - $100,000/year USD","Ottawa, ON À distance",Il y a 1 jour,Crossover for Work
7,"Senior Security Specialist, Vulnerability and Compliance Management","Brampton, ON Sur site",Il y a 3 semaines,Loblaw Companies Limited
8,"Back End Developer, Virtasant (Remote) - $80,000/year USD","Toronto, ON À distance",Il y a 1 jour,Crossover for Work
9,Insurance Advisor Trainee (Equest),"Langley, Colombie-Britannique, Canada Sur site",Il y a 5 jours,BCjobs.ca
10,"React Developer, Bloom Institute of Technology (BloomTech) (Remote) - $60,000/year USD","Toronto, ON À distance",Il y a 1 jour,Crossover for Work
11,FO 18R - Audit Analyst (BC Public Service),"Victoria, BC Sur site",Il y a 1 semaine,BCjobs.ca
12,"C++ Developer, GFI Software (Remote) - $100,000/year USD","Toronto, ON À distance",Il y a 1 jour,Crossover for Work
13,"Cloud Architect, Trilogy (Remote) - $100,000/year USD","Toronto, ON À distance",Il y a 1 jour,Crossover for Work
14,"Software Instructor, Bloom Institute of Technology (BloomTech) (Remote) - $60,000/year USD","Toronto, ON À distance",Il y a 1 jour,Crossover for Work
15,"Senior Support Engineer, Trilogy (Remote) - $60,000/year USD","Ontario, Canada À distance",Il y a 1 jour,Crossover for Work
16,"Senior Software Developer, Trilogy (Remote) - $100,000/year USD","Toronto, ON À distance",Il y a 1 jour,Crossover for Work
17,"Senior Accountant, Trilogy (Remote) - $60,000/year USD","Toronto, ON À distance",Il y a 1 jour,Crossover for Work
18,Assistant Branch Manager (Equest),"Vancouver, BC Sur site",Il y a 1 semaine,BCjobs.ca
19,"Principal Software Engineer (with C), Skyvera (Remote) - $100,000/year USD","Toronto, ON À distance",Il y a 1 jour,Crossover for Work
20,"Sales Development Representative, IgniteTech (Remote) - $60,000/year USD","Halifax, NS À distance",Il y a 1 jour,Crossover for Work
21,ADMN O 24R - Policy Analyst (BC Public Service),"Victoria, BC Sur site","Il y a 5 heures

                Au cours des 24 dernières heures",BCjobs.ca
22,Talent Acquisition Specialist (Equest),"Victoria, BC",Il y a 1 semaine,BCjobs.ca
23,"Senior Software Engineer, TelcoDR (Remote) - $160,000/year USD","Montréal, QC À distance",Il y a 1 jour,Crossover for Work
24,CLK 11R -Customer Service Representative (BC Public Service),"Kelowna, BC Sur site","Il y a 5 heures

                Au cours des 24 dernières heures",BCjobs.ca
