,job,location,date,company
0,Customer Success Manager,"Île-de-France, France Hybride",Il y a 2 jours,Implicity
1,Consultant Talend Cloud- Remote- MA / Freelance,"Paris, Île-de-France, France À distance",Il y a 3 jours,Freelance-info.fr
2,Core Developer,"Nantes, Pays de la Loire, France",Il y a 2 jours,Jobs via eFinancialCareers
3,Chef de projet/ Product Owner Assurance Vie F/H,"Paris, Île-de-France, France Sur site",Il y a 4 jours,Kangourou Kids
4,Stage Assistant(e) RH H/F,"Roussillon, Provence-Alpes-Côte d’Azur, France Sur site",Il y a 1 semaine,Michelin
5,Stage/Alternance - Business development (H/F),"Lyon, Auvergne-Rhône-Alpes, France Sur site",Il y a 2 semaines,FactSet
6,Software Engineer Internship,"Paris, Île-de-France, France",Il y a 2 semaines,Jobs via eFinancialCareers
7,STAGE - APPUI A L'ANIMATION DU DIALOGUE AVEC LE SECTEUR PRIVE FRANCAIS ET SON ECOSYSTEME - F/H,"Paris, Île-de-France, France Sur site",Il y a 5 jours,Jobs via eFinancialCareers
8,Chargé de Projets et Reporting Risques opérationnels F/ H,"Paris, Île-de-France, France Sur site",Il y a 1 semaine,Jobs via eFinancialCareers
9,Support Pricing,"Paris, Île-de-France, France Sur site",Il y a 2 jours,Toptal
10,Unity Developer,"Reims, Grand Est, France À distance","Il y a 21 heures

                Au cours des 24 dernières heures",PharmiWeb.Jobs
11,Clinical Research Associate (CRA) I - sponsor-dedicated,"Paris, Île-de-France, France",Il y a 3 semaines,Advenis
12,Chef de projet technique (H/F),Paris et périphérie Sur site,Il y a 1 semaine,Jobs via eFinancialCareers
13,Python Quant Developer,"Paris, Île-de-France, France",Il y a 6 jours,Circle
14,Venture Portfolio Platform Manager,"Villanova, Corse, France À distance",Il y a 5 jours,Tictactrip
15,Full Stack Developer,"Paris, Île-de-France, France Hybride",Il y a 1 semaine,Jobs via eFinancialCareers
16,Research analyst / Assistant PM,"Paris, Île-de-France, France Sur site",Il y a 2 semaines,Jobs via eFinancialCareers
17,Administrateur Base de Données (DBA) SQL SERVER - SYBASE,"Paris, Île-de-France, France Sur site",Il y a 1 jour,Agoda
18,Back End Senior Software Engineer,"Paris, Île-de-France, France",Il y a 2 semaines,Diebold Nixdorf
19,Project Manager-Software,"Vélizy-Villacoublay, Île-de-France, France Sur site",Il y a 1 mois,Queensland Health
20,Operational Officers - Clermont Multi-Purpose Health Service - Expression of Interest for Ongoing Opportunities,"Clermont-Ferrand, Auvergne-Rhône-Alpes, France Sur site",Il y a 2 mois,Toptal
21,Développeur PL-SQL,"Aix-en-Provence, Provence-Alpes-Côte d’Azur, France Sur site",Il y a 1 mois,Agoda
22,Unity Developer,"Dijon, Bourgogne-Franche-Comté, France À distance","Il y a 21 heures

                Au cours des 24 dernières heures",Jobs via eFinancialCareers
23,"Engineering Manager / Director (Bangkok based, relocation provided)","Paris, Île-de-France, France",Il y a 2 semaines,
24,RPA Engineer,"Paris, Île-de-France, France",Il y a 2 semaines,
