,job,location,date,company
0,Analyste KYC (BFI)-F/H,"Paris, Île-de-France, France Sur site",Il y a 1 semaine,Jobs via eFinancialCareers
1,Clinical Research Associate,Brest et périphérie,Il y a 5 jours,PharmiWeb.Jobs
2,CRA Junior - Paris - différentes aires thérapeutiques,"Paris, Île-de-France, France",Il y a 1 semaine,Syneos Health
3,Electronic Technician M/F - Permanent contract,"Marne-la-Vallée, Île-de-France, France Sur site",Il y a 2 semaines,Disneyland Paris
4,Conseiller commercial,"Angers, Pays de la Loire, France Hybride","Il y a 4 heures

                Au cours des 24 dernières heures",Bruce.work
5,Alternance - Assistant(e) de Direction,"Paris, Île-de-France, France Sur site",Il y a 1 mois,UBS
6,Clinical Research Associate,Brest et périphérie,Il y a 5 jours,PharmiWeb.Jobs
7,Help Desk Tier I Technician,"US, Île-de-France, France Sur site","Il y a 10 heures

                Au cours des 24 dernières heures",TekSynap
8,Data Engineer,"Rouen, Normandie, France À distance","Il y a 22 heures

                Au cours des 24 dernières heures",Toptal
9,Data Engineer,"Lille, Hauts-de-France, France À distance","Il y a 21 heures

                Au cours des 24 dernières heures",Toptal
10,Stage - Chargé de mission environnement,"La Madeleine, Hauts-de-France, France Sur site",Il y a 1 semaine,Roquette
11,Helpdesk,"Paris, Île-de-France, France Sur site",Il y a 1 mois,TeamRH
12,Mandataire d'Assurance (F/H)- Somme,"Somme, Centre-Val de Loire, France Sur site",Il y a 1 mois,AXA en France
13,Technical Content Writer _ Bilingual Eng/Fr,"Montpellier, Occitanie, France À distance",Il y a 1 semaine,CodinGame
14,Product Designer,"Ville de Paris, Île-de-France, France Hybride",Il y a 1 jour,Jus Mundi
15,Mandataire d'Assurance - (F/H) Dpt 13,"Arles, Provence-Alpes-Côte d’Azur, France Sur site",Il y a 1 mois,AXA en France
16,Stage – Assistant Banquier Privé Equipe Ultra High Net Worth,"Paris, Île-de-France, France Sur site",Il y a 1 mois,UBS
17,Stage - ACV - Développement d'un pneu compétition (H/F),"Clermont-Ferrand, Auvergne-Rhône-Alpes, France Sur site",Il y a 4 jours,Michelin
18,Market Insights Specialist Food & Beverage m/f/d,"Ville de Paris, Île-de-France, France Sur site",Il y a 5 jours,Geiger Food Ingredients Recruitment & Consult.Ing
19,Intern,Brest et périphérie Sur site,Il y a 3 semaines,PharmiWeb.Jobs
20,CDI - Inspecteur Audit Marchés/Modèles (Audit interne) H/F,"Paris, Île-de-France, France Sur site",Il y a 1 semaine,Jobs via eFinancialCareers
21,STAGE - SECTEUR PRIVE - F/H,"Paris, Île-de-France, France Sur site",Il y a 4 jours,Jobs via eFinancialCareers
22,Stage - Développeur KAFKA (H/F),"Clermont-Ferrand, Auvergne-Rhône-Alpes, France Sur site",Il y a 3 semaines,Michelin
23,"People BI Specialist (Bangkok Based, Relocation Provided)","Nice, Provence-Alpes-Côte d’Azur, France",Il y a 1 semaine,Agoda
24,Clinical Research Associate,"Paris, Île-de-France, France",Il y a 1 semaine,PharmiWeb.Jobs
