,job,location,date,company
0,Gestionnaire Back-office OST,"Paris, Île-de-France, France Sur site",Il y a 1 mois,Jobs via eFinancialCareers
1,Développeur front-end,"Ville de Paris, Île-de-France, France Hybride",Il y a 1 jour,Tailor-nft
2,Sr. Software Engineer (Remote),"Paris, Île-de-France, France À distance",Il y a 2 semaines,CrowdStrike
3,CHEF DE PROJET SENIOR H/F,"Paris, Île-de-France, France Sur site",Il y a 1 mois,Jobs via eFinancialCareers
4,Junior TC service engineer,"Lyon, Auvergne-Rhône-Alpes, France Sur site",Il y a 2 semaines,Aggreko
5,Préparateur de Commandes H/F,"Val-de-la-Haye, Normandie, France Sur site","Il y a 9 heures

                Au cours des 24 dernières heures",Bruce.work
6,Ingénieur production,"Ville de Paris, Île-de-France, France Sur site","Il y a 9 heures

                Au cours des 24 dernières heures",EPI SYSTEM
7,Technicien de maintenance,"Vélizy-Villacoublay, Île-de-France, France Sur site",Il y a 1 jour,ATN PARTNERS
8,TM0122 - Technicien(ne) de laboratoire en recherche translationnelle,"Bordeaux, Nouvelle-Aquitaine, France Sur site","Il y a 23 heures

                Au cours des 24 dernières heures",Explicyte
9,Senior Data Analyst – Beds Network [Bangkok],"Paris, Île-de-France, France",Il y a 2 semaines,Agoda
10,Product Owner M/F - Permanent Contract,"Île-de-France, France Sur site",Il y a 2 semaines,Disneyland Paris
11,Analyste Quantitatif Risque de Crédit (H/F),"Paris, Île-de-France, France Sur site",Il y a 3 semaines,Jobs via eFinancialCareers
12,Chef de projet Affaires Réglementaire H/F,"Gentilly, Île-de-France, France Sur site",Il y a 1 semaine,BIOCODEX
13,Consultant/Manager ALM/RISK,"Paris, Île-de-France, France Sur site",Il y a 3 semaines,Jobs via eFinancialCareers
14,Chargé de production de reportings liquidités H/F,"Paris, Île-de-France, France Sur site",Il y a 1 semaine,Jobs via eFinancialCareers
15,Support technique Automatisme à Bourges (H/F),"Saint-Doulchard, Centre-Val de Loire, France Sur site",Il y a 4 mois,Michelin
16,"Tech Firm, Corp M&A, Paris","Paris, Île-de-France, France Sur site",Il y a 1 mois,Jobs via eFinancialCareers
17,Business Development Specialist – French speaker (Budapest-based),"Nice, Provence-Alpes-Côte d’Azur, France",Il y a 4 jours,Agoda
18,Stage Middle Officer,"Paris, Île-de-France, France Sur site",Il y a 2 semaines,Jobs via eFinancialCareers
19,COST CONTROLLER (H/F/NB),"Puteaux, Île-de-France, France Sur site",Il y a 6 jours,MAMA SHELTER
20,Stage : Ingénieur AI Ops,"Lyon, Auvergne-Rhône-Alpes, France Sur site",Il y a 1 mois,Airbus
21,Cockpit Operation Specialist and Function Designer (h/f),"Toulouse, Occitanie, France",Il y a 1 mois,Airbus
22,CAISSIER (H/F),"Colmar, Grand Est, France Sur site",Il y a 3 semaines,Showpad
23,Powerplant Integration Test Specialist (m/f),"Toulouse, Occitanie, France Sur site",Il y a 2 semaines,
24,Product Manager User Management,France À distance,Il y a 6 jours,
