,job,location,date,company
0,Lead Field Civil Engineer (Site),"Riyad, Arabie saoudite Sur site",Il y a 6 jours,Bechtel Corporation
1,Aftermarket Projects Engineer,"First Industrial City, Province de l'Est, Arabie saoudite Sur site","Il y a 10 heures

                Au cours des 24 dernières heures",ITT Inc.
2,Hospitality Recruiter - Based in Riyadh,"Riyad, Riyad, Arabie saoudite Sur site",Il y a 6 jours,Michael Page
3,"Senior Analyst, Partner Communications(Bangkok based, Relocation provided)","Riyad, Riyad, Arabie saoudite",Il y a 1 semaine,Agoda
4,"Business Development Manager, Beds Network – Saudi Arabia (Jeddah based)","Riyad, Riyad, Arabie saoudite",Il y a 2 semaines,Agoda
5,Anesthesia Specialist,"Abha, Asir, Arabie saoudite Sur site",Il y a 1 mois,Antal International
6,"Project Manager, Urban Planning - Saudi Arabia",Province de la Mecque Sur site,Il y a 1 semaine,ewi recruitment
7,Production Planner,"Al Khobar, Province de l'Est, Arabie saoudite Sur site",Il y a 1 mois,Rawabi Holding Group
8,Project Coordinator for a Saudi Engineering Company,"Djeddah, La Mecque, Arabie saoudite Sur site",Il y a 1 mois,GlobalFoundries
9,Assoc Eng Equipment Engineering,Province d’Asir Sur site,Il y a 3 semaines,Agoda
10,"Business Development Manager, Beds Network – Saudi Arabia (Jeddah based)","Riyad, Riyad, Arabie saoudite",Il y a 2 semaines,GlobalFoundries
11,Assoc Eng Equipment Engineering,Province d’Asir Sur site,Il y a 3 semaines,Jet Aviation
12,Training Manager / Flight Operation Administrator,"Djeddah, La Mecque, Arabie saoudite Sur site",Il y a 1 semaine,"McDermott International, Ltd"
13,Senior Process Engineer,"Al Khobar, Province de l'Est, Arabie saoudite Sur site",Il y a 2 jours,Jobskey Search and Selection
14,Recruitment Senior Officer,"La Mecque, La Mecque, Arabie saoudite Sur site",Il y a 1 mois,Agoda
15,"Business Development Manager, Beds Network – Saudi Arabia (Jeddah based)","Djeddah, La Mecque, Arabie saoudite",Il y a 2 semaines,Bechtel Corporation
16,"Assistant Resident Engineer - High-voltage substations, Jubail, (International Assignment)","Jubail, Province de l'Est, Arabie saoudite Sur site",Il y a 1 semaine,Areeb Human Resources Company
17,Talent Acquisition Manager,"Riyad, Arabie saoudite Sur site",Il y a 5 jours,Jet Aviation
18,Director of Maintenance (DOM),"Djeddah, La Mecque, Arabie saoudite Sur site",Il y a 1 semaine,Agoda
19,"Business Development Manager, Beds Network – Saudi Arabia (Jeddah based)","Djeddah, La Mecque, Arabie saoudite",Il y a 2 semaines,Network Recruitment
20,Business Development Manager,"Riyad, Arabie saoudite Sur site",Il y a 2 semaines,Bechtel Corporation
21,Lead Structural Engineer (SAMI),"Riyad, Arabie saoudite Sur site",Il y a 1 jour,Eli Lilly and Company
22,Clinical Research Physician,Province de Riyad,Il y a 2 jours,Kyndryl
23,Saudi Procurement Professional,Province de Riyad,Il y a 1 mois,Mood Group Recruitment
24,Maintenance Manager - Flexible Packaging - Saudi Arabia,"Riyad, Riyad, Arabie saoudite Sur site",Il y a 1 mois,
